{
    "cardId": "TACTIC_CHARGE",
    "collectionNumber": "SD-119",
    "series": { "seriesId": "sovereign-dawn", "seriesName": "Sovereign Dawn", "cardNumber": 119, "totalCards": 219 },
    "name": "Charge",
    "type": "Tactic",
    "element": "Neutral",
    "rarity": {
        "tier": "Common",
        "stars": 1,
        "maxStars": 3,
        "points": 1
    },
    "stats": {
        "manaCost": 15
    },
    "abilities": [
        {
            "abilityId": "ABILITY_CHARGE",
            "name": "Charge",
            "type": "Active",
            "manaCost": 15,
            "cooldown": 1,
            "description": "Target unit may move and attack in the same turn, gaining momentum to strike swiftly."
        }
    ],
    "lore": "Speed and aggression turn the tide of battle before the enemy can respond.",
    "acquisition": {
        "packSources": [
            "standard-pack"
        ],
        "campaignDrops": [
            "location-01",
            "location-02"
        ]
    }
}
